,Title,Citations,Date,Summary,Subfield,Topic,Doi,Open Acess,OA Url,Journal,WashU Proxy Server:
19,Spectroscopy of temporary anion states: Renner–Teller coupling and electronic autodetachment in copper difluoride anion,19,2019-01-01,"Photoelectron angular distributions determined in small energy increments between 3.522 and 3.650 eV reveal distinctly different detachment mechanisms within the CuF<sub>2</sub><sup>-</sup>(X <sup>1</sup>Σ) → linear CuF<sub>2</sub>(X <sup>2</sup>Σ) + e<sup>-</sup> band. Certain channels also display non-Franck-Condon behaviour, the action spectra of which reveal rich structure. The behaviour reflects excitation to an electronically unbound anion state (at the linear geometry). The effects of the intermediate state are observed in the detachment behaviour at photon energies down to the X <sup>1</sup>Σ→ X <sup>2</sup>Σ threshold. Adiabatic CAP-EOM-CCSD (equation of motion coupled cluster singles and doubles, including a complex absorbing potential) energy curves are presented along the bending coordinate, showing the complexity of anion and neutral states for this system. The photodetachment action spectra represent a spectroscopic probe of the vibronic state energies in the vertical excitation region and highlight the need for treatment of vibronic coupling in systems involving the loss of an electron.","Atomic and Molecular Physics, and Optics",Advanced Chemical Physics Studies,https://doi.org/10.1039/c8fd00224j,False,,Faraday Discussions,https://libproxy.wustl.edu/login?url=https://doi.org/10.1039/c8fd00224j
20,Threshold effects in I−⋅CH3CN and I−⋅H2O cluster anion detachment: The angular distribution as an indicator of electronic autodetachment,18,2010-04-06,"I(-) x H(2)O and I(-) x CH(3)CN cluster anion photodetachment properties (photoelectron spectra and angular distributions) are recorded via velocity mapped photoelectron imaging for wavelengths between 270 and 340 nm, in small energy increments. These are compared with free I(-) detachment results and reveal the presence of a sharp change in the angular distribution for the (2)P(3/2) spin orbit channel in the vicinity of the (2)P(1/2) threshold. The effect is seen at this threshold in the I(-) x H(2)O cluster anion and just below threshold for I(-) x CH(3)CN. The effect is attributed to an electronic autodetachment process, which is dependent on electronic energy transfer mediated by the electron-neutral complex produced in the excitation process. These results highlight the potential of cluster anion detachment as a probe of electron-molecule interactions and in particular the sensitivity of the angular distributions to intracluster electron transfer processes.","Atomic and Molecular Physics, and Optics",Advanced Chemical Physics Studies,https://doi.org/10.1063/1.3380664,False,,The Journal of Chemical Physics,https://libproxy.wustl.edu/login?url=https://doi.org/10.1063/1.3380664
21,"The dependence of the fluorescence properties, laser properties and photochemical stability of aromatic compounds on the molecular symmetry",18,2000-10-01,No abstract available.,Physical and Theoretical Chemistry,Photochemistry and Electron Transfer Studies,https://doi.org/10.1016/s1386-1425(00)00277-8,False,,Spectrochimica Acta Part A: Molecular and Biomolecular Spectroscopy,https://libproxy.wustl.edu/login?url=https://doi.org/10.1016/s1386-1425(00)00277-8
22,Time-resolved electron detachment imaging of the I− channel in I2Br− photodissociation,18,2004-06-16,"The evolution of the I(-) channel in I(2)Br(-) photodissociation is examined using time-resolved negative-ion photoelectron imaging spectroscopy. The 388 nm photodetachment images obtained at variable delays following 388 nm excitation reveal the transformation of the excess electron from that belonging to an excited trihalide anion to that occupying an atomic orbital localized on the I(-) fragment. With increasing pump-probe delay, the corresponding photoelectron band narrows on a approximately 300 fs time scale. This trend is attributed to the localization of the excess-electron wave function on the atomic-anion fragment and the establishment of the fragment's electronic identity. The corresponding band position drifts towards larger electron kinetic energies on a significantly longer, approximately 1 ps, time scale. The gradual spectral shift is attributed to exit-channel interactions affecting the photodetachment energetics, as well as the photoelectron anisotropy. The time-resolved angular distributions are analyzed and found consistent with the formation of the asymptotic I(-) fragment.",Spectroscopy,Mass Spectrometry Techniques and Applications,https://doi.org/10.1063/1.1756869,False,,The Journal of Chemical Physics,https://libproxy.wustl.edu/login?url=https://doi.org/10.1063/1.1756869
23,Vibrationally mediated photodissociation of H2O2 (4vOH): rotational state dependent photodissociation cross sections and vibrational state mixing,17,1993-03-01,No abstract available.,Spectroscopy,Spectroscopy and Laser Applications,https://doi.org/10.1016/0009-2614(93)89201-r,False,,Chemical Physics Letters,https://libproxy.wustl.edu/login?url=https://doi.org/10.1016/0009-2614(93)89201-r
24,Photoelectron Imaging as a Quantum Chemistry Visualization Tool,15,2011-08-05,"An overview and simple example of photoelectron imaging is presented, highlighting its efficacy as a pedagogical tool for visualizing quantum phenomena. Specifically, photoelectron imaging of H– (the simplest negative ion) is used to demonstrate several quantum mechanical principles. This example could be incorporated into an introductory quantum chemistry course to extend the traditional discussion of the photoelectric effect and photoelectron spectroscopy into the area of matter waves. In working through this example, several core quantum-mechanical topics and concepts have been explored, such as conservation of angular momentum, the transition dipole moment, components of the hydrogenic orbitals, the Born interpretation of the wave function, and the theory of quantum measurement.","Atomic and Molecular Physics, and Optics",Laser-Matter Interactions and Applications,https://doi.org/10.1021/ed100177h,False,,Journal of Chemical Education,https://libproxy.wustl.edu/login?url=https://doi.org/10.1021/ed100177h
25,The effect of intracluster photoelectron interactions on the angular distribution in I−⋅CH3I photodetachment,14,2009-11-23,"I(-) and I(-)*CH(3)I velocity mapped photodetachment images are recorded over wavelengths between 270 and 370 nm. Spectral similarities, in conjunction with ab initio calculations show that the cluster anion comprises an atomic iodide anion moiety solvated by a relatively unperturbed CH(3)I molecule. Between 340-370 nm and at 280 nm, free I(-) is produced via a process analogous to dissociative electron attachment within the cluster anion. More strikingly, the photoelectron angular distribution for each species at a given electron kinetic energy is very different, despite detachment occurring from the iodide 5p orbital in each case. These observations reveal the effect of interaction of the photoelectron with the neutral cluster residue and are discussed in terms of resonances associated primarily with the CH(3)I molecule.","Atomic and Molecular Physics, and Optics",Advanced Chemical Physics Studies,https://doi.org/10.1063/1.3266936,False,,The Journal of Chemical Physics,https://libproxy.wustl.edu/login?url=https://doi.org/10.1063/1.3266936
26,Inter-channel effects in monosolvated atomic iodide cluster anion detachment: Correlation of the anisotropy parameter with solvent dipole moment,13,2012-03-15,"Photoelectron imaging results are presented for I(-)[middle dot]X cluster anions (X = CO(2), C(4)H(5)N [pyrrole], (CH(3))(2)CO, CH(3)NO(2)). The available detachment channels are labeled according to the neutral iodine atom states produced (channel I ≡ (2)P(3/2) and channel II ≡ (2)P(1/2)). At photon energies in the vicinity of the channel II threshold these data are compared to previously reported results for I(-)[middle dot]X (X = CH(3)CN, CH(3)Cl, CH(3)Br, and H(2)O). In particular, these results show a strong connection between the dipole moment of the solvent molecule and the behavior of the channel I photoelectron angular distributions in this region, which is consistent with an electronic autodetachment process. The evolution of the channel II:channel I branching ratios in this excitation regime supports this contention.","Atomic and Molecular Physics, and Optics",Advanced Chemical Physics Studies,https://doi.org/10.1063/1.3694244,False,,The Journal of Chemical Physics,https://libproxy.wustl.edu/login?url=https://doi.org/10.1063/1.3694244
27,"I − ⋅ CH 3 X  (X=Cl,Br,I) photodetachment: The effect of electron-molecule interactions in cluster anion photodetachment spectra and angular distributions",13,2010-10-08,"The electron kinetic energy dependence of the photoelectron spectra and angular distributions of I(-)⋅CH(3)X (X=Cl,Br,I) cluster anions are measured via velocity mapped imaging at wavelengths between 350 and 270 nm. Processes analogous to those encountered in free CH(3)X-electron interactions are revealed. In particular, the presence and energies of resonances associated with a low lying σ(∗) state have a marked effect on the results of I(-)⋅CH(3)X photoexcitation. These effects (vibrational excitation, product anion production, and alteration of the photoelectron angular distribution) are far more prominent for I(-)⋅CH(3)I. However, in the vicinity of the (2)P(1/2) threshold there is a sharp deviation in the (2)P(3/2) channel angular distribution and an enhancement of the (2)P(3/2) channel vibrational structure of all three cluster anions. These latter effects are specific to the cluster anion environment through the relaxation of the partner excited I atom and subsequent electronic autodetachment.","Atomic and Molecular Physics, and Optics",Advanced Chemical Physics Studies,https://doi.org/10.1063/1.3487739,False,,The Journal of Chemical Physics,https://libproxy.wustl.edu/login?url=https://doi.org/10.1063/1.3487739
28,Luminescence-laser classification of heteroaromatic and aromatic compounds,13,2002-01-01,No abstract available.,Physical and Theoretical Chemistry,Photochemistry and Electron Transfer Studies,https://doi.org/10.1016/s1386-1425(01)00544-3,False,,Spectrochimica Acta Part A: Molecular and Biomolecular Spectroscopy,https://libproxy.wustl.edu/login?url=https://doi.org/10.1016/s1386-1425(01)00544-3
29,Channel branching ratios in CH2CN− photodetachment: Rotational structure and vibrational energy redistribution in autodetachment,9,2017-12-20,"We report photoelectron spectra of CH<sub>2</sub>CN<sup>-</sup>, recorded at photon energies between 13 460 and 15 384 cm<sup>-1</sup>, which show rapid intensity variations in particular detachment channels. The branching ratios for various spectral features reveal rotational structure associated with autodetachment from an intermediate anion state. Calculations using equation-of-motion coupled-cluster method with single and double excitations reveal the presence of two dipole-bound excited anion states (a singlet and a triplet). The computed oscillator strength for the transition to the singlet dipole-bound state provides an estimate of the autodetachment channel contribution to the total photoelectron yield. Analysis of the different spectral features allows identification of the dipole-bound and neutral vibrational levels involved in the autodetachment processes. For the most part, the autodetachment channels are consistent with the vibrational propensity rule and normal mode expectation. However, examination of the rotational structure shows that autodetachment from the ν<sub>3</sub> (v = 1 and v = 2) levels of the dipole-bound state displays behavior counter to the normal mode expectation with the final state vibrational level belonging to a different mode.","Atomic and Molecular Physics, and Optics",Advanced Chemical Physics Studies,https://doi.org/10.1063/1.5001475,False,,The Journal of Chemical Physics,https://libproxy.wustl.edu/login?url=https://doi.org/10.1063/1.5001475
30,Comprehensive study of solar conditions in Mozambique: the effect of trade winds on solar components,9,2003-04-25,No abstract available.,Artificial Intelligence,Solar Radiation and Photovoltaics,https://doi.org/10.1016/s0960-1481(03)00038-7,False,,Renewable Energy,https://libproxy.wustl.edu/login?url=https://doi.org/10.1016/s0960-1481(03)00038-7
31,Role of the Electron–Dipole Interaction in Photodetachment Angular Distributions,8,2021-10-08,"The importance of including long-range electron-molecule interactions in treatments of photodetachment and/or photoionization is demonstrated. A combined experimental and computational study of CN<sup>-</sup> detachment is presented in which near threshold anisotropy parameters (β) are measured via photoelectron imaging. Calculated β values, based on an EOM-IP-CCSD/aug-cc-pVTZ Dyson orbital, are obtained using free-particle and point dipole models. The results demonstrate the influence of the molecular dipole moment in the detachment process and provide an explanation of the recently reported near threshold behavior of the overall photodetachment cross section in CN<sup>-</sup> detachment.","Atomic and Molecular Physics, and Optics",Advanced Chemical Physics Studies,https://doi.org/10.1021/acs.jpclett.1c02882,False,,The Journal of Physical Chemistry Letters,https://libproxy.wustl.edu/login?url=https://doi.org/10.1021/acs.jpclett.1c02882
32,"Photochromism, anomalous multi-banded fluorescence and laser properties of some amino- and tosyl-amino derivatives of oxadiazole",8,2006-02-22,"The multi-banded fluorescence and laser properties of 11 new amino- and tosylamino derivatives of 2,5-di(phenyl)-1,3,4-oxadiazole and oxadiazole in various solvents at 293 K are reported. All the compounds investigated possess intra-molecular hydrogen quasi-bond (IHB) of 4.6-5.2 kcal mol(-1) in the ground state. In the excited state they can undergo protolytic dissociation or intra-molecular photon-initiated transfer of proton and reveal anomalous fluorescence which cannot be explained within the framework of the Kasha and Kasha-Vavilov rules. Depending upon the excitation wavelength, solvent, concentration and pH of the medium, the compounds studied show a single, double, triple or even a four-banded fluorescence, which has not been reported earlier. The nature of multi-banded fluorescence is explained in terms of the possible photochromic processes in excited states. Quantum yields and decay times of the different fluorescence bands are reported. Anomalous dependence of quantum yield upon concentration of the solution is observed. Laser properties of the compounds studied are carefully tested. Laser action based on the fluorescence of the so-called bi-radical molecules is reported. Various possible arrangements of singlet and triplet levels of compounds investigated are discussed.",Physical and Theoretical Chemistry,Photochemistry and Electron Transfer Studies,https://doi.org/10.1016/j.saa.2005.10.031,False,,Spectrochimica Acta Part A: Molecular and Biomolecular Spectroscopy,https://libproxy.wustl.edu/login?url=https://doi.org/10.1016/j.saa.2005.10.031
33,Characterization of the vibrational properties of copper difluoride anion and neutral ground states via direct and indirect photodetachment spectroscopy,7,2018-08-23,"Photoelectron spectra of <sup>63</sup>CuF<sub>2</sub><sup>-</sup> are reported at wavelengths 310 nm, 346.6 nm, and 350.1 nm, obtained via velocity map imaging. The photoelectron angular distributions allow for the unambiguous assignment of a <sup>2</sup>Σ<sub>g</sub><sup>+</sup> neutral CuF<sub>2</sub> ground state. Vibrational analysis of the direct detachment transitions in the spectra enables accurate determination of the anion and neutral bond length difference (0.073 Å), adiabatic electron affinity of CuF<sub>2</sub> (3.494 eV) and symmetric stretching (500 cm<sup>-1</sup>, anion, and 630 cm<sup>-1</sup>, neutral) and antisymmetric stretching (610 cm<sup>-1</sup>, anion, and 782 cm<sup>-1</sup> neutral) frequencies of the ground electronic states. Strongly photon energy dependent intensities are also observed for select transitions. Equation-of-motion coupled-cluster singles and doubles calculations augmented by a complex absorbing potential reveal a metastable <sup>1</sup>Π<sub>g</sub> anion state which is optically accessible due to Renner-Teller coupling. Mediation of the detachment process by this state allows measurement of the bending frequencies (177 cm<sup>-1</sup>, anion, and 200 cm<sup>-1</sup>, neutral) completing the inventory of experimentally measured vibrational properties of the ground electronic states.",Inorganic Chemistry,Inorganic Fluorides and Related Compounds,https://doi.org/10.1063/1.5040122,False,,The Journal of Chemical Physics,https://libproxy.wustl.edu/login?url=https://doi.org/10.1063/1.5040122
34,Intra-cluster photoelectron interactions: Scattering and dissociative attachment in halide-methyl halide cluster anions,7,2009-11-01,Comparison of photodetachment images of I-·CH3I with those of I- and I-·CH3Cl over a range of wavelengths reveals generally similar spectral features but a strikingly different evolution of the photoelectron angular distributions. These measurements reveal the effect of intracluster electron scattering and in particular the influence of a vibrational Feshbach resonance on the angular distributions of the I-·CH3I photodetachment.,"Atomic and Molecular Physics, and Optics",Advanced Chemical Physics Studies,https://doi.org/10.1088/1742-6596/194/1/012051,True,https://iopscience.iop.org/article/10.1088/1742-6596/194/1/012051/pdf,Journal of Physics: Conference Series,https://libproxy.wustl.edu/login?url=https://doi.org/10.1088/1742-6596/194/1/012051
35,Photodetachment and photodissociation of the linear OCuO<sup>−</sup>molecular anion: energy and time dependence of Cu<sup>−</sup>production,6,2013-10-02,"A photodissociative study of CuO2(-) is presented using a combination of energy and time domain photoelectron spectroscopy. Ion source conditions are used that solely produce linear OCuO(-). Photodissociation of this isomer to produce Cu(-) + O2 is conclusively demonstrated at wavelengths between 765 and 340 nm. Nanosecond pulsed photoexcitation at wavelengths shorter than 340 nm produces single photon detachment transitions from the first excited state of CuO2(-). At longer wavelengths narrow Cu(-) fragment transitions are observed as a result of a sequential two photon process. In addition, the longer wavelengths produce a weak, broad two photon dependent signal, the result of detachment of the dissociating linear isomer. Time resolved pump-probe measurements reveal a long timescale growth (up to 150 ps) of the Cu(-) fragment yield, consistent with the unfavorable starting geometry for the dissociative process and indicating a potential energy surface which has one or more substantial barriers to dissociation.",Materials Chemistry,Copper-based nanomaterials and applications,https://doi.org/10.1039/c3cp52986j,False,,Phys. Chem. Chem. Phys.,https://libproxy.wustl.edu/login?url=https://doi.org/10.1039/c3cp52986j
36,I−·(CH3I)2 photoexcitation: The influence of dipole bound states on detachment and fragmentation,4,2011-06-01,"We present the results of a photoelectron imaging study of the I(-)·(CH(3)I)(2) cluster anion over excitation wavelengths 355-260 nm. The resulting spectra and photoelectron angular distributions (PADs) suggest extensive electron-molecule interaction following photoexcitation. Fragmentation channels are observed subsequent to excitation between 355 and 330 nm. The origin of these features, which begin 200 meV and peak 70 meV below the X band direct detachment threshold, is described in terms of a predissociative dipole bound state. The nature of the fragments detected and the energetics of the channel opening argue strongly in favor of an asymmetric, head to tail cluster anion geometry posited by Dessent et al. [Acc. Chem. Res. 31, 527 (1998)]. Above the direct detachment threshold, PADs display evidence of phenomena akin to electron-molecule scattering. The fragment anions disappear above the X band threshold but reappear some distance below the second (A) direct detachment band. At these energies there is also rapid variation of the X band PAD, an observation attributed to autodetachment via spin-orbit relaxation of the iodine core of the cluster.","Atomic and Molecular Physics, and Optics",Advanced Chemical Physics Studies,https://doi.org/10.1063/1.3594177,False,,The Journal of Chemical Physics,https://libproxy.wustl.edu/login?url=https://doi.org/10.1063/1.3594177
37,Near threshold Cl−·CH3I photodetachment: Apparent 2P1/2 channel suppression and enhanced 2P3/2 channel vibrational excitation,4,2011-05-13,"Cl(-)·CH(3)I cluster anion photoelectron images are recorded over a range of detachment wavelengths in the immediate post threshold region. The photoelectron spectral features fall into two categories. A number of weak, photon energy dependent transitions are observed and attributed to atomic anion fragmentation products. Several more intense, higher electron binding energy transitions result from single photon cluster anion detachment. Comparison with I(-)·CH(3)I suggests that the detachment process is more complicated for Cl(-)·CH(3)I. The single photon transition spacing is consistent with CH(3)I ν(3) mode excitation, but the two distinct vibronic bands of I(-)·CH(3)I detachment are not easily distinguished in the Cl(-)·CH(3)I spectra. Similarly, while the spectral intensities for both cluster anions show non-Franck Condon behavior, the level of vibrational excitation appears greater for Cl(-)·CH(3)I detachment. These observations are discussed in terms of low lying electronic states of CH(3)I along the C-I coordinate, and the influence of the CH(3)I moiety on the neutral halogen atom states.","Atomic and Molecular Physics, and Optics",Advanced Chemical Physics Studies,https://doi.org/10.1063/1.3583812,False,,The Journal of Chemical Physics,https://libproxy.wustl.edu/login?url=https://doi.org/10.1063/1.3583812
38,The overlooked role of excited anion states in NiO2− photodetachment,4,2024-01-23,"Photodetachment spectra of anionic species provide significant insights into the energies and nature of ground and excited states of both the anion and resultant neutral molecules. Direct detachment of the excess electron to the continuum may occur via formally allowed or forbidden transitions (perhaps as the result of intensity borrowing through vibronic coupling). However, alternate indirect pathways are also possible and often overlooked. Here, we report a two-dimensional photoelectron spectral study, combined with correlated electronic structure calculations, to elucidate the nature of photodetachment from NiO2-. The spectra are comprised of allowed and forbidden transitions, in excellent agreement with previously reported slow electron velocity mapped imaging spectra of the same system, which were interpreted in terms of direct detachment. In the current work, the contributions of indirect processes are revealed. Measured oscillations in the branching ratios of the spectral channels clearly indicate non-direct detachment processes, and the electronic structure calculations suggest that excited states of the appropriate symmetry and degeneracy lie slightly above the neutral ground state. Taken together, the results suggest that the origin of the observed forbidden transitions is the result of anion excited states mediating the electron detachment process.",Physical and Theoretical Chemistry,Photochemistry and Electron Transfer Studies,https://doi.org/10.1063/5.0188066,False,,The Journal of Chemical Physics,https://libproxy.wustl.edu/login?url=https://doi.org/10.1063/5.0188066
39,Photoelectron Angular Distributions as Probes of Cluster Anion Structure: I<sup>–</sup>·(H<sub>2</sub>O)<sub>2</sub> and I<sup>–</sup>·(CH<sub>3</sub>CN)<sub>2</sub>,4,2014-01-13,"The use of photoelectron angular distributions to provide structural details of cluster environments is investigated. Photoelectron spectra and angular distributions of I(-)·(H2O)2 and I(-)·(CH3CN)2 cluster anions are recorded over a range of photon energies. The anisotropy parameter (β) for electrons undergoes a sharp change (Δβmax) at photon energies close to a detachment channel threshold. I(-)·(H2O)2 results show the relationship between dipole moment and Δβmax to be similar to that observed in monosolvated I(-) detachment. The Δβmax of the 4.0 eV band in the I(-)·(CH3CN)2 photoelectron spectrum suggests a dipole moment of 5-6 D. This is consistent with predictions of a hydrogen bonded conformer of the I(-)·(CH3CN)2 cluster anion [Timerghazin, Q. K.; Nguyen, T. N.; Peslherbe, G. H. J. Chem. Phys. 2002, 116, 6867-6870].",Inorganic Chemistry,Inorganic Fluorides and Related Compounds,https://doi.org/10.1021/jp4104596,False,,The Journal of Physical Chemistry A,https://libproxy.wustl.edu/login?url=https://doi.org/10.1021/jp4104596
