,Title,Citations,Date,Summary,Subfield,Topic,Doi,Open Acess,OA Url,Journal,WashU Proxy Server:
40,Dipole effects in the photoelectron angular distributions of the sulfur monoxide anion,3,2022-01-01,"Photoelectron angular distributions (PADs) in SO<sup>-</sup> photodetachment using linearly polarized 355 nm (3.49 eV), 532 nm (2.33 eV), and 611 nm (2.03 eV) light were investigated <i>via</i> photoelectron imaging spectroscopy. The measurements at 532 and 611 nm access the X<sup>3</sup>Σ<sup>-</sup> and a<sup>1</sup>Δ electronic states of SO, whereas the measurements at 355 nm also access the b<sup>1</sup>Σ<sup>+</sup> state. In aggregate, the photoelectron anisotropy parameter values follow the general trend with respect to electron kinetic energy (eKE) expected for π*-orbital photodetachment. The trend is similar to O<sub>2</sub><sup>-</sup>, but the minimum of the SO<sup>-</sup> curve is shifted to smaller eKE. This shift is mainly attributed to the exit-channel interactions of the departing electron with the dipole moment of the neutral SO core, rather than the differing shapes of the SO<sup>-</sup> and O<sub>2</sub><sup>-</sup> molecular orbitals. Of the several <i>ab initio</i> models considered, two approaches yield good agreement with the experiment: one representing the departing electron as a superposition of eigenfunctions of a point dipole-field Hamiltonian, and another describing the outgoing electron in terms of Coulomb waves originating from two separated charge centers, with a partial positive charge on the sulfur and an equal negative charge on the oxygen. These fundamentally related approaches support the conclusion that electron-dipole interactions in the exit channel of SO<sup>-</sup> photodetachment play an important role in shaping the PADs. While a similar conclusion was previously reached for photodetachment from σ orbitals of CN<sup>-</sup> (Hart, Lyle, Spellberg, Krylov, Mabbs, <i>J. Phys. Chem. Lett.</i>, 2021, <b>12</b>, 10086-10092), the present work includes the first extension of the dipole-field model to detachment from π* orbitals.","Atomic and Molecular Physics, and Optics",Advanced Chemical Physics Studies,https://doi.org/10.1039/d2cp03337b,False,,Physical Chemistry Chemical Physics,https://libproxy.wustl.edu/login?url=https://doi.org/10.1039/d2cp03337b
41,Photoelectron Imaging of Anions Illustrated by 310 Nm Detachment of F&lt;sup&gt;&amp;#8722;&lt;/sup&gt;,2,2018-07-27,"Anion photoelectron imaging is a very efficient method for the study of energy states of bound negative ions, neutral species and interactions of unbound electrons with neutral molecules/atoms. State-of-the-art in vacuo anion generation techniques allow application to a broad range of atomic, molecular, and cluster anion systems. These are separated and selected using time-of-flight mass spectrometry. Electrons are removed by linearly polarized photons (photo detachment) using table-top laser sources which provide ready access to excitation energies from the infra-red to the near ultraviolet. Detecting the photoelectrons with a velocity mapped imaging lens and position sensitive detector means that, in principle, every photoelectron reaches the detector and the detection efficiency is uniform for all kinetic energies. Photoelectron spectra extracted from the images via mathematical reconstruction using an inverse Abel transformation reveal details of the anion internal energy state distribution and the resultant neutral energy states. At low electron kinetic energy, typical resolution is sufficient to reveal energy level differences on the order of a few millielectron-volts, i.e., different vibrational levels for molecular species or spin-orbit splitting in atoms. Photoelectron angular distributions extracted from the inverse Abel transformation represent the signatures of the bound electron orbital, allowing more detailed probing of electronic structure. The spectra and angular distributions also encode details of the interactions between the outgoing electron and the residual neutral species subsequent to excitation. The technique is illustrated by the application to an atomic anion (F<sup>-</sup>), but it can also be applied to the measurement of molecular anion spectroscopy, the study of low lying anion resonances (as an alternative to scattering experiments) and femtosecond (fs) time resolved studies of the dynamic evolution of anions.","Atomic and Molecular Physics, and Optics",Atomic and Molecular Physics,https://doi.org/10.3791/57989,True,https://www.jove.com/pdf/57989/photoelectron-imaging-of-anions-illustrated-by-310-nm-detachment-of-f,Journal of Visualized Experiments,https://libproxy.wustl.edu/login?url=https://doi.org/10.3791/57989
42,Observation of vibration-dependent electron anisotropy in O− photodetachment,1,2010-01-01,No abstract available.,Biomedical Engineering,Photocathodes and Microchannel Plates,,False,,,https://libproxy.wustl.edu/login?url=None
43,Intra-cluster photoelectron interactions: Scattering and dissociative attachment in halide – methyl halide cluster anions,1,2009-11-01,"I- and I-CH3I photodetachment over a range of wavelengths generally shows similar spectral features but strikingly different photoelectron angular distributions. The difference in angular distribution is due to intracluster electron scattering. Additionally, within narrow energy ranges, the cluster anion detachment yields new spectral transitions. These correspond to excitation of a vibrational Feshbach resonance and subsequent fragmentation, analogous to a dissociative electron attachment process. Fs time resolved studies of dissociative electron attachment are discussed.","Atomic and Molecular Physics, and Optics",Advanced Chemical Physics Studies,https://doi.org/10.1088/1742-6596/194/5/052034,True,https://doi.org/10.1088/1742-6596/194/5/052034,Journal of Physics: Conference Series,https://libproxy.wustl.edu/login?url=https://doi.org/10.1088/1742-6596/194/5/052034
44,Pushing resolution in frequency and time: general discussion,1,2019-01-01,"Stefan Willitsch opened the general discussion of the paper by Stephan Schlemmer: While I accept that He is the best tag to have, it is still a tag and it would be better to use methods which do not require tagging, e.g., laser-induced inhibition of cluster growth (LIICG). I was intrigued by a",Electrical and Electronic Engineering,Advanced Electrical Measurement Techniques,https://doi.org/10.1039/c9fd90033k,True,http://hdl.handle.net/2066/214873,Faraday Discussions,https://libproxy.wustl.edu/login?url=https://doi.org/10.1039/c9fd90033k
45,AUTODETACHMENT OF CH2CN_ VIEWED WITH HIGH RESOLUTION PHOTOELECTRON IMAGING,0,2019-06-19,No abstract available.,Electrical and Electronic Engineering,Gas Sensing Nanomaterials and Sensors,https://doi.org/10.15278/isms.2019.wf03,True,https://www.ideals.illinois.edu/bitstream/2142/104232/4/1379920.pdf,Proceedings of the 74th International Symposium on Molecular Spectroscopy,https://libproxy.wustl.edu/login?url=https://doi.org/10.15278/isms.2019.wf03
46,ELECTRON ANISOTROPY AS A SIGNATURE OF MODE SPECIFIC ISOMERIZATION IN VINYLIDENE [Research supported by the Australian Research Council Discovery Project Grant DP160102585],0,2016-06-20,No abstract available.,"Surfaces, Coatings and Films",Electron and X-Ray Spectroscopy Techniques,https://doi.org/10.15278/isms.2016.mf08,False,,Proceedings of the 71st International Symposium on Molecular Spectroscopy,https://libproxy.wustl.edu/login?url=https://doi.org/10.15278/isms.2016.mf08
47,VIBRATIONAL MODE-SPECIFIC AUTODETACHMENT AND COUPLING OF CH2CN-,0,2017-06-20,"The Cyanomethyl Anion, CH 2 CN-, and neutral radical have been studied extensively, with several findings of autodetachment about the totally symmetric transition, as well as high resolution experiments revealing symmetrically forbidden and weak vibrational features. We report photoelectron spectra using the Velocity-Mapped Imaging Technique in 1-2 cm -1 increments over a range of 13460 to 15384 cm -1 that has not been previously examined. These spectra include excitation of the ground state cyanomethyl anion into the direct detachment thresholds of previously reported vibrational modes for the neutral radical. Significant variations from Franck-Condon behavior were observed in the branching ratios for resolved vibrational features for excitation in the vicinity of the thresholds involving the 3 and 5 modes. These are consistent with autodetachment from rovibrational levels of a dipole bound state acting as a resonance in the detachment continuum. The autodetachment channels involve single changes in vibrational quantum number, consistent with the vibrational propensity rule but in some cases reveal relaxation to a different vibrational mode indicating coupling between the modes and/or a breakdown of the normal mode approximation.",Spectroscopy,Analytical Chemistry and Chromatography,https://doi.org/10.15278/isms.2017.tg10,True,https://ideals-main.s3.us-east-2.amazonaws.com/institutions/uiuc/storage/104704/2605.pdf,Proceedings of the 72nd International Symposium on Molecular Spectroscopy,https://libproxy.wustl.edu/login?url=https://doi.org/10.15278/isms.2017.tg10
48,Stabilized resonances are no less exciting,0,2021-07-22,No abstract available.,"Atomic and Molecular Physics, and Optics",Advanced Chemical Physics Studies,https://doi.org/10.1038/s41557-021-00755-6,False,,Nature Chemistry,https://libproxy.wustl.edu/login?url=https://doi.org/10.1038/s41557-021-00755-6
49,SUPEROXIDE PHOTOELECTRON ANGULAR DISTRIBUTIONS: VIBRATIONAL DEPENDENCE AS A CONSQUENCE OF BORN-OPPENHEIMER BEHAVIOR,0,2010-06-01,"Author Institution: Department of Chemistry, Washington University, One Brookings Dr., Campus Box 1134 Saint Louis, Missouri 63130, USA; Research School of Physical Sciences and Engineering, The Australian National University, Canberra, Australian Capital Territory 0200, Australia",Bioengineering,Analytical Chemistry and Sensors,,False,,65th International Symposium On Molecular Spectroscopy,https://libproxy.wustl.edu/login?url=None
50,Dipole Effects in the Photoelectron Angular Distributions of the Sulfur Monoxide Anion,0,2022-07-24,"Photoelectron angular distributions (PADs) in SO- photodetachment using linearly polarized 355 nm (3.49 eV), 532 nm (2.33 eV), and 611 nm (2.03 eV) light were investigated via photoelectron imaging spectroscopy. The measurements at 532 and 611 nm access the X-^3-Σ^- and a-^1-Delta electronic states of SO, whereas the measurements at 355 nm also access the b-^1Σ^+ state. In aggregate, the photoelectron anisotropy parameter values follow the general trend with respect to electron kinetic energy (eKE) expected for π* orbital photodetachment. The trend is similar to O2-, but the minimum of the SO- curve is shifted to smaller eKE. This shift is attributed mainly to the exit-channel interactions of the departing electron with the dipole moment of the neutral SO core, rather than the differing shapes of the SO- and O2- molecular orbitals. Of the several ab initio models considered, two approaches yield good agreement with the experiment: one representing the departing electron as a superposition of eigenfunctions of a point dipole-field Hamiltonian, and another describing the outgoing electron in terms of Coulomb waves originating from two separated charge centers, with a partial positive charge on the sulfur and an equal negative charge on the oxygen. These fundamentally related approaches support the conclusion that electron-dipole interactions in the exit channel of SO- photodetachment play an important role in shaping the PADs. While a similar conclusion was previously reached for photodetachment from sigma orbitals of CN- (Hart, Lyle, Spellberg, Krylov, Mabbs, J. Phys. Chem. Lett., 2021, 12, 10086-10092), the present work includes the first extension of the dipole-field model to detachment from π* orbitals.","Atomic and Molecular Physics, and Optics",Advanced Chemical Physics Studies,https://doi.org/10.26434/chemrxiv-2022-43sd6,True,https://chemrxiv.org/engage/api-gateway/chemrxiv/assets/orp/resource/item/62d983c7468933537563e0e1/original/dipole-effects-in-the-photoelectron-angular-distributions-of-the-sulfur-monoxide-anion.pdf,,https://libproxy.wustl.edu/login?url=https://doi.org/10.26434/chemrxiv-2022-43sd6
51,On the Role of the Electron-Dipole Interaction in Photodetachment Angular Distributions,0,2021-09-16,"The importance of including long-range electron-molecule interactions in treatments of photodetachment/photoionization is demonstrated. A combined experimental and computational study of CN− detachment is presented in which near threshold anisotropy parameters (β) are measured via photoelectron imaging. Calculated β values, based on an EOM-IP-CCSD/aug-cc-pVTZ Dyson orbital, are obtained using free particle and point dipole models. The results demonstrate the influence of the molecular dipole moment in the detachment process, and provide an explanation of the near threshold behavior of the overall photodetachment cross section in CN− detachment [J. Chem. Phys. 2020, 153, 184309]","Surfaces, Coatings and Films",Electron and X-Ray Spectroscopy Techniques,https://doi.org/10.33774/chemrxiv-2021-9h59t,True,https://doi.org/10.33774/chemrxiv-2021-9h59t,,https://libproxy.wustl.edu/login?url=https://doi.org/10.33774/chemrxiv-2021-9h59t
52,On the Role of the Electron-Dipole Interaction in Photodetachment Angular Distributions,0,2021-09-15,"The importance of including long-range electron-molecule interactions in treatments of photodetachment/photoionization is demonstrated. A combined experimental and computational study of CN− detachment is presented in which near threshold anisotropy parameters (β) are measured via photoelectron imaging. Calculated β values, based on an EOM-IP-CCSD/aug-cc-pVTZ Dyson orbital, are obtained using free particle and point dipole models. The results demonstrate the influence of the molecular dipole moment in the detachment process, and provide an explanation of the near threshold behavior of the overall photodetachment cross section in CN− detachment [J. Chem. Phys. 2020, 153, 184309]","Surfaces, Coatings and Films",Electron and X-Ray Spectroscopy Techniques,https://doi.org/10.26434/chemrxiv-2021-9h59t,True,https://chemrxiv.org/engage/api-gateway/chemrxiv/assets/orp/resource/item/613f7d5490051e3277f20d9a/original/on-the-role-of-the-electron-dipole-interaction-in-photodetachment-angular-distributions.pdf,,https://libproxy.wustl.edu/login?url=https://doi.org/10.26434/chemrxiv-2021-9h59t
53,Exotic systems: general discussion,0,2019-01-01,"Laura McCaslin opened the discussion of the paper by Anna Krylov: You use the molecule C22− for your reference wavefunction in studying the neutral C2 using EOM-DIP-CCSD. General good practice suggests that the reference wavefunction for EOM-CC methods is closed-shell and well-behaved, though C",Statistical and Nonlinear Physics,Advanced Thermodynamics and Statistical Mechanics,https://doi.org/10.1039/c9fd90035g,False,,Faraday Discussions,https://libproxy.wustl.edu/login?url=https://doi.org/10.1039/c9fd90035g
